show id,type,title,country,release year,duration,listed inside
s6412,TV Show,Camp X,Canada,2014,1 Season,Docuseries
s6413,Movie,Camp X-Ray,United States,2014,117 min,"Dramas, Independent Movies"
s6414,TV Show,Can We Get Married?,South Korea,2012,1 Season,"International TV Shows, Korean TV Shows, Romantic TV Shows"
s6415,Movie,Can't Hardly Wait,United States,1998,101 min,"Comedies, Romantic Movies"
s6416,Movie,Candyman,"United States, United Kingdom",1992,99 min,"Cult Movies, Horror Movies"
s6417,TV Show,Cannabis,France,2016,1 Season,"Crime TV Shows, International TV Shows, TV Dramas"
s6418,Movie,Capital in the Twenty-First Century,"France, New Zealand",2019,103 min,Documentaries
s6419,Movie,Cappuccino,India,2017,126 min,"Comedies, Dramas, International Movies"
s6420,Movie,Cardboard Gangsters,Ireland,2016,92 min,"Dramas, International Movies"
s6421,TV Show,Care Bears: Welcome to Care-a-Lot,United States,2012,1 Season,Kids' TV
s6422,Movie,Caregiver,Philippines,2008,131 min,"Dramas, International Movies"
s6423,Movie,Carol,"United Kingdom, United States, Australia",2015,119 min,"Dramas, LGBTQ Movies, Romantic Movies"
s6424,Movie,Carrie,United States,1976,98 min,"Classic Movies, Cult Movies, Horror Movies"
s6425,Movie,Carriers,United States,2009,85 min,"Horror Movies, Sci-Fi & Fantasy, Thrillers"
s6426,Movie,Casa de mi Padre,"United States, Mexico",2012,84 min,Comedies
s6427,TV Show,Case Closed,Japan,2015,1 Season,"Anime Series, Crime TV Shows, TV Thrillers"
s6428,Movie,Casino Royale,"United Kingdom, Czech Republic, United States, Germany, Bahamas",2006,145 min,Action & Adventure
s6429,Movie,Casino Tycoon,Hong Kong,1992,125 min,"Action & Adventure, Dramas, International Movies"
s6430,Movie,Casino Tycoon 2,Hong Kong,1992,108 min,"Action & Adventure, Dramas, International Movies"
s6431,TV Show,Castle of Stars,,2015,1 Season,"International TV Shows, Romantic TV Shows, TV Comedies"
s6432,Movie,Cat on a Hot Tin Roof,United States,1958,108 min,"Classic Movies, Dramas"
s6433,Movie,Catching the Sun,"China, Germany, India, United States",2015,74 min,Documentaries
s6434,Movie,Cats & Dogs: The Revenge of Kitty Galore,"United States, Australia",2010,82 min,"Children & Family Movies, Comedies"
s6435,Movie,Catwalk: Tales from the Cat Show Circuit,Canada,2018,75 min,"Documentaries, International Movies"
s6436,Movie,Cave,Norway,2016,77 min,"Action & Adventure, International Movies, Thrillers"
s6437,Movie,Celluloid Man,India,2012,156 min,"Documentaries, International Movies"
s6438,Movie,Center Stage,United States,2000,116 min,Dramas
s6439,Movie,Chaar Sahibzaade,India,2014,126 min,"Dramas, Faith & Spirituality, International Movies"
s6440,Movie,Chal Dhar Pakad,India,2010,129 min,"Comedies, Dramas, International Movies"
s6441,Movie,Chal Mere Bhai,India,2000,132 min,"Comedies, International Movies, Romantic Movies"
s6442,Movie,Chalay Thay Saath,Pakistan,2017,118 min,"Comedies, Dramas, International Movies"
s6443,Movie,Chandani: The Daughter of the Elephant Whisperer,"Germany, Sri Lanka",2010,87 min,"Documentaries, International Movies"
s6444,Movie,Change in the Air,United States,2018,95 min,Dramas
s6445,Movie,Chaotic Love Poems,Indonesia,2016,86 min,"Dramas, International Movies, Romantic Movies"
s6446,Movie,Chappaquiddick,"United States, Sweden",2017,106 min,Dramas
s6447,Movie,Charlie and the Chocolate Factory,"United Kingdom, United States",2005,115 min,"Children & Family Movies, Comedies"
s6448,Movie,Charlie's Angels: Full Throttle,United States,2003,106 min,"Action & Adventure, Comedies"
s6449,Movie,Charlotte's Web,United States,1973,94 min,"Children & Family Movies, Classic Movies"
s6450,Movie,Chashme Buddoor,India,2013,121 min,"Comedies, International Movies, Music & Musicals"
s6451,Movie,Chasing Amy,United States,1997,113 min,"Comedies, Cult Movies, Dramas"
s6452,TV Show,Chasing Monsters,Canada,2016,2 Seasons,"Docuseries, Reality TV, Science & Nature TV"
s6453,Movie,Chasing the Dragon,"Hong Kong, China",2017,129 min,"Action & Adventure, Dramas, International Movies"
s6454,Movie,Chasing Trane,United States,2016,99 min,"Documentaries, Music & Musicals"
s6455,Movie,Chauthi Koot,"India, France",2015,116 min,"Dramas, Independent Movies, International Movies"
s6456,TV Show,Cheapest Weddings,Australia,2016,1 Season,"International TV Shows, Reality TV"
s6457,TV Show,Cheers,United States,1992,11 Seasons,"Classic & Cult TV, TV Comedies"
s6458,TV Show,Chef & My Fridge,South Korea,2017,2 Seasons,"International TV Shows, Korean TV Shows, Reality TV"
s6459,Movie,Chernobyl Diaries,United States,2012,88 min,"Horror Movies, Thrillers"
s6460,TV Show,Chewin' the Fat,United Kingdom,1999,1 Season,"British TV Shows, TV Comedies"
s6461,TV Show,Chewing Gum,United Kingdom,2017,2 Seasons,"British TV Shows, International TV Shows, Romantic TV Shows"
s6462,Movie,Chhota Bheem Aur Kaala Yodha,,2018,63 min,Movies
s6463,Movie,Chhota Bheem Ka Romani Adventure,,2018,62 min,Children & Family Movies
s6464,Movie,Chhota Bheem Ka Troll Se Takkar,,2018,62 min,Movies
s6465,Movie,Chhota Bheem Kungfu Dhamaka,India,2019,112 min,Children & Family Movies
s6466,Movie,Chicken Kokkachi,India,2017,113 min,"Comedies, International Movies"
s6467,Movie,Chicken Little,United States,2005,82 min,"Children & Family Movies, Comedies"
s6468,Movie,Chief Daddy,Nigeria,2018,98 min,"Comedies, Dramas, International Movies"
s6469,Movie,Child's Play,United States,1988,87 min,"Cult Movies, Horror Movies"
s6470,TV Show,Chill with Bob Ross,,1994,1 Season,TV Shows
s6471,Movie,China Salesman,China,2017,111 min,"Action & Adventure, International Movies"
s6472,Movie,Chingo Bling: They Can't Deport Us All,,2017,63 min,Stand-Up Comedy
s6473,Movie,Chittagong,"United States, India, Bangladesh",2012,105 min,"Dramas, Independent Movies, International Movies"
s6474,Movie,Chitty Chitty Bang Bang,"United Kingdom, United States",1968,146 min,"Children & Family Movies, Classic Movies, Comedies"
s6475,Movie,Chloe,"United States, Canada, France",2009,96 min,"Independent Movies, Thrillers"
s6476,Movie,Chris Brown: Welcome to My Life,United States,2017,80 min,"Documentaries, Music & Musicals"
s6477,Movie,Christian Mingle,United States,2014,99 min,"Comedies, Faith & Spirituality, Romantic Movies"
s6478,TV Show,Christiane Amanpour: Sex & Love Around the World,United States,2018,1 Season,Docuseries
s6479,Movie,Christmas Crush,"Canada, United States",2012,87 min,"Comedies, Romantic Movies"
s6480,Movie,Christmas in the Smokies,United States,2015,88 min,"Children & Family Movies, Dramas, Romantic Movies"
s6481,Movie,Christmas with the Kranks,United States,2004,99 min,"Children & Family Movies, Comedies"
s6482,Movie,Christopher Robin,United States,2018,104 min,"Children & Family Movies, Comedies, Dramas"
s6483,Movie,Chronicle of an Escape,Argentina,2006,104 min,"Dramas, International Movies, Thrillers"
s6484,TV Show,Chuck Chicken,Malaysia,2017,1 Season,Kids' TV
s6485,Movie,Chupan Chupai,Pakistan,2017,118 min,"Comedies, International Movies"
s6486,Movie,Chupke Chupke,India,1975,127 min,"Classic Movies, Comedies, International Movies"
s6487,Movie,Cirque du Freak: The Vampire's Assistant,United States,2009,109 min,"Action & Adventure, Horror Movies, Sci-Fi & Fantasy"
s6488,TV Show,City in the Sky,United Kingdom,2016,1 Season,"British TV Shows, Docuseries, Science & Nature TV"
s6489,Movie,City of God,"Brazil, France, Germany",2002,130 min,"Dramas, Independent Movies, International Movies"
s6490,Movie,City of Tiny Lights,United Kingdom,2016,110 min,"Dramas, International Movies, Thrillers"
s6491,TV Show,Civilizations,United Kingdom,2018,1 Season,"British TV Shows, Docuseries"
s6492,Movie,Clarence Clemons: Who Do I Think I Am?,United States,2019,88 min,"Documentaries, Music & Musicals"
s6493,Movie,Clash of the Titans,"United States, United Kingdom, Australia",2010,106 min,"Action & Adventure, Sci-Fi & Fantasy"
s6494,Movie,Class of '61,United States,1993,91 min,Dramas
s6495,Movie,Class Rank,United States,2018,103 min,Comedies
s6496,TV Show,Classic Legends,India,2012,1 Season,"Docuseries, International TV Shows"
s6497,Movie,Cleopatra Jones,United States,1973,89 min,"Action & Adventure, Classic Movies"
s6498,Movie,Click,United States,2006,108 min,"Comedies, Sci-Fi & Fantasy"
s6499,TV Show,Click for Murder,United Kingdom,2017,1 Season,"British TV Shows, Crime TV Shows, Docuseries"
s6500,Movie,Clive Davis: The Soundtrack of Our Lives,United States,2017,124 min,"Documentaries, Music & Musicals"
s6501,Movie,Closed Circuit,"United Kingdom, United States",2013,96 min,"Dramas, Thrillers"
s6502,Movie,Cloud Atlas,"Germany, United States, Hong Kong, Singapore",2012,172 min,"Action & Adventure, Cult Movies, Dramas"
s6503,Movie,Clouds of Sils Maria,"France, Germany, Switzerland",2014,124 min,"Dramas, International Movies"
s6504,Movie,Cloverfield,United States,2008,85 min,"Action & Adventure, Horror Movies, Sci-Fi & Fantasy"
s6505,TV Show,Club Friday The Series 6,,2015,9 Seasons,"International TV Shows, Romantic TV Shows, TV Dramas"
s6506,TV Show,Club Friday The Series 7,,2016,7 Seasons,"International TV Shows, Romantic TV Shows, TV Dramas"
s6507,TV Show,Club Friday The Series 8,,2017,8 Seasons,"International TV Shows, Romantic TV Shows, TV Comedies"
s6508,TV Show,Club Friday To Be Continued - Friend & Enemy,,2016,1 Season,"International TV Shows, Romantic TV Shows, TV Dramas"
s6509,TV Show,Club Friday To Be Continued - My Beautiful Tomboy,,2016,1 Season,"International TV Shows, Romantic TV Shows, TV Comedies"
s6510,TV Show,Club Friday To Be Continued - The Promise,,2016,1 Season,"International TV Shows, Romantic TV Shows, TV Dramas"
s6511,Movie,Coach Carter,"United States, Germany",2005,137 min,"Dramas, Sports Movies"
s6512,Movie,Code Name: The Cleaner,United States,2007,91 min,"Action & Adventure, Comedies"
s6513,Movie,Coffee with D,India,2017,120 min,"Comedies, Independent Movies, International Movies"
s6514,TV Show,Cold Case Files,United States,2017,1 Season,"Crime TV Shows, Docuseries"
s6515,TV Show,Cold Case Files Classic,United States,1999,1 Season,"Crime TV Shows, Docuseries"
s6516,Movie,Colkatay Columbus,India,2016,118 min,"Comedies, Dramas, Independent Movies"
s6517,Movie,Colonia,"Germany, France, Luxembourg, United Kingdom, United States",2015,110 min,"Dramas, Independent Movies, International Movies"
s6518,Movie,Colours of Passion,India,2008,114 min,"Dramas, International Movies"
s6519,Movie,Come and Find Me,"Canada, United States, United Kingdom",2016,112 min,"Dramas, Thrillers"
s6520,TV Show,Comedy Bang! Bang!,United States,2016,5 Seasons,"Stand-Up Comedy & Talk Shows, TV Comedies"
s6521,TV Show,Comedy High School,,2018,1 Season,"International TV Shows, TV Comedies"
s6522,Movie,Command and Control,United States,2017,92 min,Documentaries
s6523,Movie,Company,India,2002,137 min,"Action & Adventure, Dramas, International Movies"
s6524,Movie,Compulsion,"United Kingdom, Canada, Italy",2016,84 min,"Dramas, Thrillers"
s6525,TV Show,Conan Without Borders,United States,2018,1 Season,"Docuseries, TV Comedies"
s6526,Movie,Concrete Football,"Czech Republic, France",2016,52 min,"Documentaries, International Movies, Sports Movies"
s6527,Movie,Concussion,United States,2013,96 min,"Dramas, Independent Movies, LGBTQ Movies"
s6528,Movie,Conjuring Spirit,Vietnam,2014,112 min,"Horror Movies, International Movies, Thrillers"
s6529,Movie,Conor McGregor: Notorious,Ireland,2017,90 min,"Documentaries, Sports Movies"
s6530,Movie,Consequences ,Turkey,2014,106 min,"Dramas, International Movies, Thrillers"
s6531,Movie,Contract,India,2008,116 min,"Action & Adventure, Dramas, Independent Movies"
s6532,Movie,Convict,,2014,97 min,"Dramas, International Movies"
s6533,TV Show,Cooking on High,United States,2018,1 Season,Reality TV
s6534,Movie,Cool Hand Luke,United States,1967,127 min,"Classic Movies, Dramas"
s6535,Movie,Cop and a Half: New Recruit,Canada,2017,96 min,"Children & Family Movies, Comedies"
s6536,Movie,Cop Watchers,,2016,45 min,"Documentaries, International Movies"
s6537,Movie,Coraline,United States,2009,101 min,Children & Family Movies
s6538,Movie,Counterfeiting in Suburbia,Canada,2018,88 min,"Dramas, Thrillers"
s6539,TV Show,Court Justice,Australia,2017,1 Season,"Crime TV Shows, Docuseries, International TV Shows"
s6540,Movie,Covered: Alive in Asia,United States,2016,75 min,"Documentaries, Faith & Spirituality, Music & Musicals"
s6541,Movie,Crash,"United States, Germany",2004,112 min,"Dramas, Independent Movies"
s6542,Movie,CRD,India,2016,110 min,"Comedies, Dramas, Independent Movies"
s6543,TV Show,Crime Time,France,2017,1 Season,"Crime TV Shows, International TV Shows, TV Action & Adventure"
s6544,Movie,"Crouching Tiger, Hidden Dragon","Taiwan, Hong Kong, United States, China",2000,120 min,"Action & Adventure, International Movies, Romantic Movies"
s6545,Movie,Cult of Chucky,United States,2017,90 min,Horror Movies
s6546,Movie,Cutie and the Boxer,United States,2013,82 min,Documentaries
s6547,Movie,Daagdi Chaawl,India,2015,118 min,"Action & Adventure, Dramas, International Movies"
s6548,Movie,Dabbe 6: The Return,Turkey,2015,153 min,"Horror Movies, International Movies"
s6549,Movie,Dad,United States,1989,117 min,Dramas
s6550,TV Show,Dad's Army,United Kingdom,1977,10 Seasons,"British TV Shows, Classic & Cult TV, TV Comedies"
s6551,Movie,Daddy Day Care,United States,2003,93 min,"Children & Family Movies, Comedies"
s6552,Movie,Daddy Issues,United States,2019,82 min,"Dramas, Independent Movies, LGBTQ Movies"
s6553,Movie,Daemonium,Argentina,2015,115 min,"Action & Adventure, Horror Movies, International Movies"
s6554,Movie,Daffedar,India,2017,151 min,"Dramas, International Movies"
s6555,Movie,Dagh Ujala,"United States, India",2015,103 min,"Dramas, Independent Movies, International Movies"
s6556,Movie,Dallas Buyers Club,United States,2013,117 min,"Dramas, Independent Movies, LGBTQ Movies"
s6557,TV Show,Dance Academy,Australia,2013,1 Season,"International TV Shows, Romantic TV Shows, TV Dramas"
s6558,Movie,Dance Academy: The Comeback,"Germany, Australia",2017,100 min,"Dramas, International Movies"
s6559,Movie,Dancing Quietly,Germany,2016,70 min,"Dramas, Independent Movies, International Movies"
s6560,TV Show,Dandy,Mexico,2016,1 Season,"Crime TV Shows, International TV Shows, Spanish-Language TV Shows"
s6561,TV Show,Dangerous Roads,United Kingdom,2012,2 Seasons,"British TV Shows, Docuseries"
s6562,Movie,Danny Says,United States,2015,103 min,"Documentaries, Music & Musicals"
s6563,Movie,Dante's Peak,United States,1997,108 min,Action & Adventure
s6564,Movie,Dare to Be Wild,Ireland,2015,100 min,"Dramas, Independent Movies, Romantic Movies"
s6565,Movie,Dark Chocolate (Bengali Version),India,2016,91 min,"Dramas, International Movies, Thrillers"
s6566,Movie,Dark Crimes,"United Kingdom, Poland, United States",2016,93 min,"Dramas, Thrillers"
s6567,Movie,Dark Places,"United States, United Kingdom, France",2015,113 min,"Dramas, International Movies, Thrillers"
s6568,Movie,Darna Mana Hai,India,2003,116 min,"Horror Movies, International Movies, Thrillers"
s6569,TV Show,Darr Sabko Lagta Hai,India,2015,1 Season,"International TV Shows, TV Horror, TV Thrillers"
s6570,Movie,Darra,India,2016,121 min,"Dramas, International Movies"
s6571,Movie,Daughters of the Dust,"United Kingdom, United States",1991,112 min,"Classic Movies, Dramas, Independent Movies"
s6572,TV Show,Day and Night,China,2017,1 Season,"Crime TV Shows, International TV Shows, TV Dramas"
s6573,TV Show,Days We Stared at the Sun,Taiwan,2017,2 Seasons,"International TV Shows, TV Dramas"
s6574,Movie,Dayveon,United States,2017,76 min,"Dramas, Independent Movies"
s6575,Movie,De Film van Dylan Haegens,Netherlands,2018,81 min,"Comedies, International Movies"
s6576,Movie,De Palma,United States,2015,110 min,Documentaries
s6577,Movie,Dead in a Week (Or Your Money Back),United Kingdom,2018,90 min,Comedies
s6578,Movie,Deadline: Sirf 24 Ghante,India,2006,97 min,"Independent Movies, International Movies, Thrillers"
s6579,Movie,Deadly Scholars,United States,2018,86 min,"Dramas, Thrillers"
s6580,Movie,Dean,United States,2016,94 min,"Comedies, Dramas, Independent Movies"
s6581,Movie,Dear Dad,India,2016,83 min,"Comedies, Dramas, Independent Movies"
s6582,Movie,Dear Dracula,United States,2012,43 min,"Children & Family Movies, Comedies"
s6583,Movie,Dear Santa,Canada,2011,92 min,"Comedies, Romantic Movies"
s6584,Movie,Death at a Funeral,United States,2010,93 min,Comedies
s6585,Movie,Death House,United States,2017,88 min,Horror Movies
s6586,Movie,Deathgrip,United Kingdom,2017,53 min,"International Movies, Sports Movies"
s6587,TV Show,Deep Undercover Collection,United States,2017,3 Seasons,"Crime TV Shows, Docuseries"
s6588,TV Show,Deep Water,Australia,2016,1 Season,"Crime TV Shows, International TV Shows, TV Dramas"
s6589,Movie,Deewangee,India,2002,156 min,"International Movies, Thrillers"
s6590,Movie,Defying the Nazis: The Sharps' War,United States,2016,79 min,Documentaries
s6591,Movie,Delirium,United States,2018,96 min,"Horror Movies, Thrillers"
s6592,Movie,Democrats,"Denmark, Zimbabwe",2014,99 min,"Documentaries, International Movies"
s6593,Movie,Den of Thieves,United States,2018,140 min,Action & Adventure
s6594,Movie,Denis Leary: No Cure For Cancer,United States,1992,62 min,Stand-Up Comedy
s6595,Movie,Desolate,,2018,88 min,"Dramas, Thrillers"
s6596,Movie,Desolation,United States,2017,76 min,"Horror Movies, Thrillers"
s6597,Movie,Detention Letter,Egypt,2017,99 min,"Action & Adventure, International Movies"
s6598,Movie,Detour,"United Kingdom, South Africa",2016,97 min,Thrillers
s6599,Movie,Deviant Love,United States,2019,87 min,Thrillers
s6600,Movie,Devil's Bride,"Finland, Sweden, Norway, Latvia, Germany",2016,108 min,"Dramas, International Movies"
s6601,Movie,Devil's Gate,Canada,2017,94 min,"Horror Movies, Sci-Fi & Fantasy, Thrillers"
s6602,TV Show,Devlok with Devdutt Pattanaik,India,2017,1 Season,International TV Shows
s6603,Movie,Devrai,India,2004,123 min,"Dramas, International Movies"
s6604,TV Show,Dexter,United States,2013,8 Seasons,"Crime TV Shows, TV Dramas, TV Mysteries"
s6605,Movie,Dhamaal,India,2007,128 min,"Action & Adventure, Comedies, International Movies"
s6606,Movie,Di Renjie zhi Sidatianwang,"China, Hong Kong",2018,132 min,"Action & Adventure, International Movies, Sci-Fi & Fantasy"
s6607,Movie,Diana: 7 Days That Shook the World,United Kingdom,2017,93 min,Documentaries
s6608,Movie,Diana: In Her Own Words,United Kingdom,2017,113 min,"Documentaries, International Movies"
s6609,Movie,Diary of a Chambermaid,"France, Belgium",2015,96 min,"Dramas, International Movies"
s6610,Movie,Die Another Day,"United Kingdom, United States",2002,133 min,Action & Adventure
s6611,Movie,Dil Hai Tumhaara,India,2002,176 min,"Dramas, International Movies, Music & Musicals"
s6612,TV Show,Dinner for Five,United States,2007,1 Season,Stand-Up Comedy & Talk Shows
s6613,Movie,Dinner for Schmucks,United States,2010,115 min,Comedies
s6614,TV Show,Dino Hunt,Canada,2016,1 Season,"Docuseries, Science & Nature TV"
s6615,Movie,Disciples Of The 36th Chamber,Hong Kong,1985,90 min,"Action & Adventure, International Movies"
s6616,Movie,Discovering Bigfoot,United States,2017,111 min,Documentaries
s6617,Movie,Dismissed,United States,2017,87 min,Thrillers
s6618,Movie,District 9,"South Africa, United States, New Zealand, Canada",2009,112 min,"Action & Adventure, International Movies, Sci-Fi & Fantasy"
s6619,TV Show,Diva Brides,,2017,1 Season,"British TV Shows, Reality TV"
s6620,Movie,Doctor Zhivago,"United States, Italy, United Kingdom, Liechtenstein",1965,200 min,"Classic Movies, Dramas, Romantic Movies"
s6621,Movie,Dog Eat Dog,United States,2016,93 min,"Dramas, Thrillers"
s6622,Movie,Dolphin Kick,United States,2019,90 min,Children & Family Movies
s6623,Movie,Dolphin Tale 2,United States,2014,107 min,"Children & Family Movies, Dramas"
s6624,Movie,Domino,"Denmark, France, Belgium, Italy, Netherlands, United States, United Kingdom",2019,89 min,"International Movies, Thrillers"
s6625,Movie,Don Quixote: The Ingenious Gentleman of La Mancha,United States,2015,83 min,"Comedies, Independent Movies"
s6626,Movie,Don Verdean,United States,2015,96 min,Comedies
s6627,Movie,Don't Be Afraid of the Dark,"United States, Australia, Mexico",2010,99 min,Horror Movies
s6628,Movie,Don't Crack Under Pressure,France,2015,95 min,"Action & Adventure, Documentaries, International Movies"
s6629,Movie,Don't Crack Under Pressure II,France,2016,88 min,"Action & Adventure, Documentaries, International Movies"
s6630,Movie,Don't Crack Under Pressure III,France,2017,94 min,"Action & Adventure, Documentaries, International Movies"
s6631,Movie,Don't Knock Twice,United Kingdom,2016,93 min,"Horror Movies, International Movies"
s6632,Movie,Don't Look Down,United Kingdom,2016,93 min,"Documentaries, International Movies"
s6633,Movie,Don't Think Twice,United States,2016,92 min,"Comedies, Dramas, Independent Movies"
s6634,Movie,Donnie Brasco,United States,1997,127 min,"Dramas, Thrillers"
s6635,Movie,Doom,"United Kingdom, Czech Republic, Germany, United States",2005,105 min,"Action & Adventure, Horror Movies, Sci-Fi & Fantasy"
s6636,TV Show,Doomsday Preppers,United States,2013,1 Season,"Reality TV, Science & Nature TV"
s6637,Movie,Doubles Cause Troubles,Hong Kong,1989,94 min,"Action & Adventure, Comedies, International Movies"
s6638,Movie,Doubt,United States,2008,104 min,"Dramas, Faith & Spirituality"
s6639,Movie,Down The Fence,United States,2017,94 min,Documentaries
s6640,Movie,Dr. Seuss' The Cat in the Hat,United States,2003,82 min,"Children & Family Movies, Comedies"
s6641,Movie,Dr. Seuss' The Grinch,"France, China, Japan, United States",2018,86 min,"Children & Family Movies, Comedies"
s6642,Movie,Dragonheart,United States,1996,103 min,"Action & Adventure, Sci-Fi & Fantasy"
s6643,Movie,Dragonheart 3: The Sorcerer,United States,2015,97 min,"Action & Adventure, Sci-Fi & Fantasy"
s6644,Movie,Dragonheart: A New Beginning,United States,2000,84 min,"Action & Adventure, Sci-Fi & Fantasy"
s6645,Movie,Dragonheart: Battle for the Heartfire,United States,2017,98 min,"Action & Adventure, Sci-Fi & Fantasy"
s6646,Movie,Dragonkala Ka Rahasya,,2018,68 min,Children & Family Movies
s6647,TV Show,Dramaworld,"United States, South Korea, China",2016,1 Season,"Romantic TV Shows, TV Comedies, TV Dramas"
s6648,Movie,Dream Big: Engineering Our World,United States,2017,42 min,Documentaries
s6649,Movie,Dream Boat,Germany,2017,92 min,"Documentaries, International Movies, LGBTQ Movies"
s6650,Movie,Dries,"Germany, Belgium",2017,89 min,"Documentaries, International Movies"
s6651,Movie,Driven to Dance,United States,2018,99 min,Dramas
s6652,TV Show,"Drugs, Inc.",United States,2015,1 Season,"Crime TV Shows, Docuseries"
s6653,TV Show,Dueños del paraíso,"United States, Chile",2015,1 Season,"Crime TV Shows, International TV Shows, Spanish-Language TV Shows"
s6654,Movie,Dukhtar,"Pakistan, Norway, United States",2014,93 min,"Dramas, Independent Movies, International Movies"
s6655,Movie,Dum,India,2003,162 min,"Action & Adventure, Dramas, International Movies"
s6656,Movie,Dumb and Dumberer: When Harry Met Lloyd,United States,2003,85 min,Comedies
s6657,Movie,E-Cigarettes: Miracle or Menace?,United Kingdom,2016,52 min,Documentaries
s6658,Movie,Earth to Echo,United States,2014,91 min,"Children & Family Movies, Sci-Fi & Fantasy"
s6659,TV Show,Earth to Luna!,Brazil,2014,1 Season,Kids' TV
s6660,TV Show,Earth's Natural Wonders,United Kingdom,2015,1 Season,"British TV Shows, Docuseries, Science & Nature TV"
s6661,TV Show,Earth's Natural Wonders: Life at the Extremes,,2018,1 Season,"British TV Shows, Docuseries, Science & Nature TV"
s6662,Movie,East Side Sushi,United States,2015,106 min,Dramas
s6663,Movie,Easy A,United States,2010,92 min,"Comedies, Romantic Movies"
s6664,TV Show,Easy Fortune Happy Life,Taiwan,2009,1 Season,"International TV Shows, Romantic TV Shows, TV Comedies"
s6665,Movie,Eat Pray Love,United States,2010,140 min,"Dramas, Romantic Movies"
s6666,Movie,Eddie Murphy: Delirious,United States,1983,69 min,Stand-Up Comedy
s6667,Movie,Eeda,India,2018,153 min,"Dramas, International Movies, Romantic Movies"
s6668,Movie,Eh Janam Tumhare Lekhe,India,2015,124 min,"Dramas, International Movies"
s6669,Movie,Ek Cup Chya,India,2009,120 min,"Dramas, Independent Movies, International Movies"
s6670,Movie,Ek Hasina Thi,India,2004,134 min,"Dramas, International Movies, Thrillers"
s6671,Movie,El último testigo,"United States, Canada, Belgium, United Kingdom",2012,105 min,Action & Adventure
s6672,TV Show,El Barco,Spain,2013,3 Seasons,"International TV Shows, Romantic TV Shows, Spanish-Language TV Shows"
s6673,TV Show,El Cartel,Colombia,2008,1 Season,"Crime TV Shows, International TV Shows, Spanish-Language TV Shows"
s6674,TV Show,El Cartel 2,Colombia,2010,1 Season,"Crime TV Shows, International TV Shows, Spanish-Language TV Shows"
s6675,TV Show,El Chavo,Mexico,1979,1 Season,"Classic & Cult TV, Kids' TV, Spanish-Language TV Shows"
s6676,Movie,El Che,Venezuela,2017,119 min,"Documentaries, International Movies"
s6677,TV Show,El Clon,United States,2010,1 Season,"Romantic TV Shows, Spanish-Language TV Shows, TV Dramas"
s6678,Movie,El fin de ETA,Spain,2017,106 min,"Documentaries, International Movies"
s6679,TV Show,El Vato,United States,2017,2 Seasons,"International TV Shows, Spanish-Language TV Shows, TV Comedies"
s6680,Movie,El Viaje: Márama y Rombai,,2016,79 min,"Children & Family Movies, Documentaries, International Movies"
s6681,Movie,Elephants Dream 4 Hour,Netherlands,2006,196 min,"International Movies, Sci-Fi & Fantasy"
s6682,Movie,Elizabeth at 90: A Family Tribute,United Kingdom,2016,90 min,Documentaries
s6683,Movie,Elizabeth Harvest,United States,2019,109 min,"Dramas, Sci-Fi & Fantasy"
s6684,Movie,Elles étaient en guerre (1914-1918),France,2014,93 min,"Documentaries, International Movies"
s6685,Movie,Elles étaient en guerre 1939-1945,,2015,92 min,"Documentaries, International Movies"
s6686,Movie,Elles ont toutes une histoire,,2016,49 min,"Documentaries, International Movies"
