show id,type,title,country,release year,duration,listed inside
s1,Movie,Dick Johnson Is Dead,United States,2020,90 min,Documentaries
s2,TV Show,Blood & Water,South Africa,2021,2 Seasons,"International TV Shows, TV Dramas, TV Mysteries"
s3,TV Show,Ganglands,,2021,1 Season,"Crime TV Shows, International TV Shows, TV Action & Adventure"
s4,TV Show,Jailbirds New Orleans,,2021,1 Season,"Docuseries, Reality TV"
s5,TV Show,Kota Factory,India,2021,2 Seasons,"International TV Shows, Romantic TV Shows, TV Comedies"
s6,TV Show,Midnight Mass,,2021,1 Season,"TV Dramas, TV Horror, TV Mysteries"
s7,Movie,My Little Pony: A New Generation,,2021,91 min,Children & Family Movies
s8,Movie,Sankofa,"United States, Ghana, Burkina Faso, United Kingdom, Germany, Ethiopia",1993,125 min,"Dramas, Independent Movies, International Movies"
s9,TV Show,The Great British Baking Show,United Kingdom,2021,9 Seasons,"British TV Shows, Reality TV"
s10,Movie,The Starling,United States,2021,104 min,"Comedies, Dramas"
s11,TV Show,"Vendetta: Truth, Lies and The Mafia",,2021,1 Season,"Crime TV Shows, Docuseries, International TV Shows"
s12,TV Show,Bangkok Breaking,,2021,1 Season,"Crime TV Shows, International TV Shows, TV Action & Adventure"
s13,Movie,Je Suis Karl,"Germany, Czech Republic",2021,127 min,"Dramas, International Movies"
s14,Movie,Confessions of an Invisible Girl,,2021,91 min,"Children & Family Movies, Comedies"
s15,TV Show,Crime Stories: India Detectives,,2021,1 Season,"British TV Shows, Crime TV Shows, Docuseries"
s16,TV Show,Dear White People,United States,2021,4 Seasons,"TV Comedies, TV Dramas"
s17,Movie,Europe's Most Dangerous Man: Otto Skorzeny in Spain,,2020,67 min,"Documentaries, International Movies"
s18,TV Show,Falsa identidad,Mexico,2020,2 Seasons,"Crime TV Shows, Spanish-Language TV Shows, TV Dramas"
s19,Movie,Intrusion,,2021,94 min,Thrillers
s20,TV Show,Jaguar,,2021,1 Season,"International TV Shows, Spanish-Language TV Shows, TV Action & Adventure"
s21,TV Show,Monsters Inside: The 24 Faces of Billy Milligan,,2021,1 Season,"Crime TV Shows, Docuseries, International TV Shows"
s22,TV Show,Resurrection: Ertugrul,Turkey,2018,5 Seasons,"International TV Shows, TV Action & Adventure, TV Dramas"
s23,Movie,Avvai Shanmughi,,1996,161 min,"Comedies, International Movies"
s24,Movie,Go! Go! Cory Carson: Chrissy Takes the Wheel,,2021,61 min,Children & Family Movies
s25,Movie,Jeans,India,1998,166 min,"Comedies, International Movies, Romantic Movies"
s26,TV Show,Love on the Spectrum,Australia,2021,2 Seasons,"Docuseries, International TV Shows, Reality TV"
s27,Movie,Minsara Kanavu,,1997,147 min,"Comedies, International Movies, Music & Musicals"
s28,Movie,Grown Ups,United States,2010,103 min,Comedies
s29,Movie,Dark Skies,United States,2013,97 min,"Horror Movies, Sci-Fi & Fantasy"
s30,Movie,Paranoia,"United States, India, France",2013,106 min,Thrillers
s31,Movie,Ankahi Kahaniya,,2021,111 min,"Dramas, Independent Movies, International Movies"
s32,TV Show,Chicago Party Aunt,,2021,1 Season,TV Comedies
s33,TV Show,Sex Education,United Kingdom,2020,3 Seasons,"British TV Shows, International TV Shows, TV Comedies"
s34,TV Show,Squid Game,,2021,1 Season,"International TV Shows, TV Dramas, TV Thrillers"
s35,TV Show,Tayo and Little Wizards,,2020,1 Season,Kids' TV
s36,Movie,The Father Who Moves Mountains,,2021,110 min,"Dramas, International Movies, Thrillers"
s37,Movie,The Stronghold,,2021,105 min,"Action & Adventure, Dramas, International Movies"
s38,TV Show,Angry Birds,Finland,2018,1 Season,"Kids' TV, TV Comedies"
s39,Movie,Birth of the Dragon,"China, Canada, United States",2017,96 min,"Action & Adventure, Dramas"
s40,TV Show,Chhota Bheem,India,2021,3 Seasons,Kids' TV
s41,TV Show,He-Man and the Masters of the Universe,United States,2021,1 Season,"Kids' TV, TV Sci-Fi & Fantasy"
s42,Movie,Jaws,United States,1975,124 min,"Action & Adventure, Classic Movies, Dramas"
s43,Movie,Jaws 2,United States,1978,116 min,"Dramas, Horror Movies, Thrillers"
s44,Movie,Jaws 3,United States,1983,98 min,"Action & Adventure, Horror Movies, Thrillers"
s45,Movie,Jaws: The Revenge,United States,1987,91 min,"Action & Adventure, Horror Movies, Thrillers"
s46,Movie,My Heroes Were Cowboys,,2021,23 min,Documentaries
s47,Movie,Safe House,"South Africa, United States, Japan",2012,115 min,Action & Adventure
s48,TV Show,The Smart Money Woman,,2020,1 Season,"International TV Shows, Romantic TV Shows, TV Comedies"
s49,Movie,Training Day,United States,2001,122 min,"Dramas, Thrillers"
s50,TV Show,Castle and Castle,Nigeria,2021,2 Seasons,"International TV Shows, TV Dramas"
s51,TV Show,Dharmakshetra,India,2014,1 Season,"International TV Shows, TV Dramas, TV Sci-Fi & Fantasy"
s52,Movie,InuYasha the Movie 2: The Castle Beyond the Looking Glass,Japan,2002,99 min,"Action & Adventure, Anime Features, International Movies"
s53,Movie,InuYasha the Movie 3: Swords of an Honorable Ruler,Japan,2003,99 min,"Action & Adventure, Anime Features, International Movies"
s54,Movie,InuYasha the Movie 4: Fire on the Mystic Island,Japan,2004,88 min,"Action & Adventure, Anime Features, International Movies"
s55,Movie,InuYasha the Movie: Affections Touching Across Time,Japan,2001,100 min,"Action & Adventure, Anime Features, International Movies"
s56,TV Show,Nailed It,United States,2021,6 Seasons,Reality TV
s57,Movie,Naruto Shippuden the Movie: Blood Prison,Japan,2011,102 min,"Action & Adventure, Anime Features, International Movies"
s58,Movie,Naruto Shippûden the Movie: Bonds,Japan,2008,93 min,"Action & Adventure, Anime Features, International Movies"
s59,Movie,Naruto Shippûden the Movie: The Will of Fire,Japan,2009,96 min,"Action & Adventure, Anime Features, International Movies"
s60,Movie,Naruto Shippuden: The Movie,Japan,2007,95 min,"Action & Adventure, Anime Features, International Movies"
s61,Movie,Naruto Shippuden: The Movie: The Lost Tower,Japan,2010,85 min,"Action & Adventure, Anime Features, International Movies"
s62,Movie,Naruto the Movie 2: Legend of the Stone of Gelel,Japan,2005,97 min,"Action & Adventure, Anime Features, International Movies"
s63,Movie,Naruto the Movie 3: Guardians of the Crescent Moon Kingdom,Japan,2006,95 min,"Action & Adventure, Anime Features, International Movies"
s64,Movie,Naruto the Movie: Ninja Clash in the Land of Snow,Japan,2004,83 min,"Action & Adventure, Anime Features, International Movies"
s65,Movie,Nightbooks,,2021,103 min,Children & Family Movies
s66,TV Show,Numberblocks,United Kingdom,2021,6 Seasons,Kids' TV
s67,TV Show,Raja Rasoi Aur Anya Kahaniyan,India,2014,1 Season,"Docuseries, International TV Shows"
s68,TV Show,Saved by the Bell,United States,1994,9 Seasons,"Kids' TV, TV Comedies"
s69,Movie,Schumacher,,2021,113 min,"Documentaries, International Movies, Sports Movies"
s70,TV Show,Stories by Rabindranath Tagore,India,2015,1 Season,"International TV Shows, TV Dramas"
s71,TV Show,Too Hot To Handle: Latino,,2021,1 Season,"International TV Shows, Reality TV, Romantic TV Shows"
s72,Movie,A StoryBots Space Adventure,,2021,13 min,Children & Family Movies
s73,TV Show,Jack Whitehall: Travels with My Father,United Kingdom,2021,5 Seasons,"British TV Shows, Docuseries, International TV Shows"
s74,Movie,King of Boys,Nigeria,2018,182 min,"Dramas, International Movies"
s75,TV Show,The World's Most Amazing Vacation Rentals,,2021,2 Seasons,Reality TV
s76,Movie,You vs. Wild: Out Cold,,2021,106 min,Children & Family Movies
s77,TV Show,Yowamushi Pedal,Japan,2013,1 Season,"Anime Series, International TV Shows"
s78,Movie,Little Singham - Black Shadow,,2021,48 min,"Children & Family Movies, Comedies"
s79,Movie,Tughlaq Durbar,,2020,145 min,"Comedies, Dramas, International Movies"
s80,Movie,Tughlaq Durbar (Telugu),,2021,145 min,"Comedies, Dramas, International Movies"
s81,Movie,Firedrake the Silver Dragon,,2021,93 min,Children & Family Movies
s82,Movie,Kate,United States,2021,106 min,Action & Adventure
s83,TV Show,Lucifer,United States,2021,6 Seasons,"Crime TV Shows, TV Comedies, TV Dramas"
s84,TV Show,Metal Shop Masters,,2021,1 Season,Reality TV
s85,Movie,Omo Ghetto: the Saga,Nigeria,2020,147 min,"Action & Adventure, Comedies, Dramas"
s86,TV Show,Pokémon Master Journeys: The Series,,2021,1 Season,"Anime Series, Kids' TV"
s87,Movie,Prey,,2021,87 min,"International Movies, Thrillers"
s88,TV Show,Titipo Titipo,,2019,2 Seasons,"Kids' TV, Korean TV Shows"
s89,Movie,Blood Brothers: Malcolm X & Muhammad Ali,,2021,96 min,"Documentaries, Sports Movies"
s90,TV Show,Mighty Raju,,2017,4 Seasons,Kids' TV
s91,Movie,Paradise Hills,"Spain, United States",2019,95 min,"Sci-Fi & Fantasy, Thrillers"
s92,Movie,The Women and the Murderer,France,2021,92 min,"Documentaries, International Movies"
s93,TV Show,Into the Night,Belgium,2021,2 Seasons,"International TV Shows, TV Dramas, TV Mysteries"
s94,Movie,JJ+E,,2021,91 min,"Dramas, International Movies, Romantic Movies"
s95,Movie,Show Dogs,"United Kingdom, United States",2018,90 min,"Children & Family Movies, Comedies"
s96,TV Show,The Circle,"United States, United Kingdom",2021,3 Seasons,Reality TV
s97,Movie,If I Leave Here Tomorrow: A Film About Lynyrd Skynyrd,United States,2018,97 min,"Documentaries, Music & Musicals"
s98,TV Show,Kid Cosmic,United States,2021,2 Seasons,"Kids' TV, TV Comedies, TV Sci-Fi & Fantasy"
s99,TV Show,Octonauts: Above & Beyond,United Kingdom,2021,1 Season,"British TV Shows, Kids' TV"
s100,TV Show,On the Verge,"France, United States",2021,1 Season,"TV Comedies, TV Dramas"
s101,TV Show,Tobot Galaxy Detectives,,2019,2 Seasons,Kids' TV
s102,Movie,Untold: Breaking Point,United States,2021,80 min,"Documentaries, Sports Movies"
s103,TV Show,Countdown: Inspiration4 Mission to Space,,2021,1 Season,"Docuseries, Science & Nature TV"
s104,Movie,Shadow Parties,,2020,117 min,"Dramas, International Movies, Thrillers"
s105,TV Show,Tayo the Little Bus,South Korea,2016,2 Seasons,"Kids' TV, Korean TV Shows"
s106,Movie,Angamaly Diaries,India,2017,128 min,"Action & Adventure, Comedies, Dramas"
s107,TV Show,Bunk'd,United States,2021,5 Seasons,"Kids' TV, TV Comedies"
s108,Movie,A Champion Heart,United States,2018,90 min,"Children & Family Movies, Dramas"
s109,TV Show,Dive Club,Australia,2021,1 Season,"Kids' TV, TV Dramas, Teen TV Shows"
s110,TV Show,La casa de papel,Spain,2021,5 Seasons,"Crime TV Shows, International TV Shows, Spanish-Language TV Shows"
s111,TV Show,Money Heist: From Tokyo to Berlin,,2021,1 Season,"Docuseries, International TV Shows, Spanish-Language TV Shows"
s112,TV Show,Sharkdog,"United States, Singapore",2021,1 Season,Kids' TV
s113,Movie,Worth,,2021,119 min,Dramas
s114,Movie,Afterlife of the Party,,2021,110 min,"Comedies, Romantic Movies"
s115,Movie,Anjaam,India,1994,143 min,"Dramas, International Movies, Thrillers"
s116,Movie,Bright Star,"United Kingdom, Australia, France",2009,119 min,"Dramas, Romantic Movies"
s117,Movie,Dhanak,India,2015,114 min,"Comedies, Dramas, Independent Movies"
s118,Movie,Final Account,"United Kingdom, United States",2021,94 min,Documentaries
s119,Movie,Gurgaon,India,2017,106 min,"Dramas, International Movies, Thrillers"
s120,Movie,Here and There,,2020,99 min,"Dramas, International Movies, Romantic Movies"
s121,TV Show,Heroes of Goo Jit Zu,Australia,2021,1 Season,"Kids' TV, TV Comedies"
s122,TV Show,Hotel Del Luna,,2019,1 Season,"International TV Shows, Romantic TV Shows, TV Comedies"
s123,Movie,In the Cut,"United Kingdom, Australia, France, United States",2003,118 min,Thrillers
s124,TV Show,Luv Kushh,,2012,1 Season,Kids' TV
s125,TV Show,Pororo - The Little Penguin,South Korea,2013,3 Seasons,"Kids' TV, Korean TV Shows"
s126,TV Show,Q-Force,United States,2021,1 Season,"Crime TV Shows, TV Action & Adventure, TV Comedies"
s127,Movie,Shikara,India,2020,115 min,"Dramas, International Movies, Romantic Movies"
s128,Movie,A Cinderella Story,"United States, Canada",2004,95 min,"Children & Family Movies, Comedies"
s129,Movie,Agatha Christie's Crooked House,,2017,115 min,"Dramas, International Movies, Thrillers"
s130,Movie,An Unfinished Life,"Germany, United States",2005,108 min,Dramas
s131,Movie,Barbie Big City Big Dreams,,2021,63 min,"Children & Family Movies, Music & Musicals"
s132,Movie,Blade Runner: The Final Cut,United States,1982,117 min,"Action & Adventure, Classic Movies, Cult Movies"
s133,TV Show,Brave Animated Series,,2021,1 Season,"International TV Shows, TV Action & Adventure, TV Comedies"
s134,Movie,Chappie,"South Africa, United States",2015,121 min,"Action & Adventure, Sci-Fi & Fantasy"
s135,Movie,Clear and Present Danger,"United States, Mexico",1994,142 min,"Action & Adventure, Dramas"
s136,Movie,Cliffhanger,"United States, Italy, France, Japan",1993,113 min,Action & Adventure
s137,Movie,Cold Mountain,"United States, Italy, Romania, United Kingdom",2003,154 min,"Dramas, Romantic Movies"
s138,Movie,Crocodile Dundee in Los Angeles,"Australia, United States",2001,95 min,"Action & Adventure, Comedies"
s139,Movie,Dear John,United States,2010,108 min,"Dramas, Romantic Movies"
s140,Movie,Do the Right Thing,United States,1989,120 min,"Classic Movies, Comedies, Dramas"
s141,Movie,"El patrón, radiografía de un crimen","Argentina, Venezuela",2014,100 min,"Dramas, International Movies, Thrillers"
s142,Movie,Extraction,"United States, United Kingdom, Canada",2015,82 min,Action & Adventure
s143,Movie,Freedom Writers,"Germany, United States",2007,124 min,Dramas
s144,Movie,Green Lantern,United States,2011,114 min,"Action & Adventure, Sci-Fi & Fantasy"
s145,Movie,House Party,United States,1990,104 min,"Comedies, Cult Movies"
s146,Movie,House Party 2,United States,1991,94 min,"Comedies, Cult Movies, Music & Musicals"
s147,Movie,House Party 3,United States,1994,94 min,"Comedies, Music & Musicals"
s148,TV Show,How to Be a Cowboy,,2021,1 Season,Reality TV
s149,TV Show,HQ Barbers,,2020,1 Season,TV Shows
s150,Movie,I Got the Hook Up,United States,1998,93 min,"Action & Adventure, Comedies"
s151,Movie,In Too Deep,United States,1999,97 min,Thrillers
s152,Movie,Initial D,"China, Hong Kong",2005,109 min,"Action & Adventure, International Movies"
s153,Movie,Janoskians: Untold and Untrue,United States,2016,88 min,Comedies
s154,TV Show,Kid-E-Cats,Russia,2016,2 Seasons,Kids' TV
s155,TV Show,Kuroko's Basketball,Japan,2015,3 Seasons,"Anime Series, International TV Shows, Teen TV Shows"
s156,Movie,Labyrinth,"United Kingdom, United States",1986,101 min,"Action & Adventure, Children & Family Movies, Cult Movies"
s157,Movie,Letters to Juliet,United States,2010,105 min,"Comedies, Dramas, Romantic Movies"
s158,Movie,Level 16,Canada,2018,102 min,"Sci-Fi & Fantasy, Thrillers"
s159,Movie,Love Don't Cost a Thing,United States,2003,101 min,"Comedies, Romantic Movies"
s160,Movie,Love in a Puff,Hong Kong,2010,103 min,"Comedies, Dramas, International Movies"
s161,TV Show,Major Dad,United States,1992,4 Seasons,TV Comedies
s162,Movie,Mars Attacks!,United States,1996,106 min,"Comedies, Cult Movies, Sci-Fi & Fantasy"
s163,Movie,Marshall,"United States, China, Hong Kong",2017,118 min,Dramas
s164,Movie,My Boss's Daughter,United States,2003,86 min,"Comedies, Romantic Movies"
s165,Movie,Mystery Men,United States,1999,121 min,"Action & Adventure, Comedies"
s166,TV Show,Oldsters,,2019,1 Season,"Crime TV Shows, International TV Shows, Spanish-Language TV Shows"
s167,Movie,Once Upon a Time in America,"Italy, United States",1984,229 min,"Classic Movies, Dramas"
s168,Movie,Open Season 2,"United States, Canada",2008,76 min,"Children & Family Movies, Comedies"
s169,Movie,Osmosis Jones,United States,2001,95 min,"Action & Adventure, Children & Family Movies, Comedies"
s170,Movie,Poseidon,United States,2006,98 min,"Action & Adventure, Dramas"
s171,Movie,Rhyme & Reason,United States,1997,89 min,"Documentaries, Music & Musicals"
s172,Movie,Same Kind of Different as Me,United States,2017,120 min,"Dramas, Faith & Spirituality"
s173,Movie,School of Rock,"United States, Germany",2003,110 min,"Comedies, Music & Musicals"
s174,Movie,Snervous Tyler Oakley,United States,2015,83 min,"Documentaries, LGBTQ Movies"
s175,Movie,Tears of the Sun,United States,2003,121 min,"Action & Adventure, Dramas"
s176,Movie,The Blue Lagoon,United States,1980,105 min,"Dramas, Romantic Movies"
s177,Movie,The Golden Child,United States,1986,94 min,"Action & Adventure, Comedies"
s178,Movie,The Guns of Navarone,"United Kingdom, United States",1961,156 min,"Action & Adventure, Classic Movies"
s179,Movie,The Interview,United States,2014,112 min,"Action & Adventure, Comedies"
s180,Movie,The Nutty Professor,United States,1996,95 min,"Comedies, Romantic Movies"
s181,Movie,The Nutty Professor II: The Klumps,,2000,107 min,"Comedies, Romantic Movies"
s182,TV Show,Turning Point: 9/11 and the War on Terror,,2021,1 Season,Docuseries
s183,Movie,Welcome Home Roscoe Jenkins,United States,2008,114 min,Comedies
s184,Movie,In the Line of Fire,United States,1993,129 min,"Action & Adventure, Classic Movies"
s185,TV Show,Sparking Joy,United States,2021,1 Season,Reality TV
s186,Movie,Untold: Crime & Penalties,,2021,86 min,"Documentaries, Sports Movies"
s187,TV Show,Hometown Cha-Cha-Cha,,2021,1 Season,"International TV Shows, Romantic TV Shows, TV Comedies"
s188,TV Show,The Ingenuity of the Househusband,,2021,1 Season,"International TV Shows, TV Comedies"
s189,Movie,2 Alone in Paris,France,2008,97 min,"Comedies, International Movies"
s190,TV Show,Bread Barbershop,,2020,2 Seasons,"Kids' TV, TV Comedies"
s191,Movie,Thimmarusu,India,2021,125 min,"Dramas, International Movies"
s192,Movie,Wind River,"United Kingdom, Canada, United States",2017,107 min,"Dramas, Independent Movies"
s193,Movie,C Kkompany,India,2008,127 min,"Action & Adventure, Comedies, International Movies"
s194,TV Show,D.P.,", South Korea",2021,1 Season,"International TV Shows, TV Dramas"
s195,TV Show,Deadly Sins,,2002,1 Season,"International TV Shows, Spanish-Language TV Shows, TV Dramas"
s196,Movie,EMI: Liya Hai To Chukana Padega,India,2008,128 min,"Comedies, Dramas, International Movies"
s197,Movie,He's All That,,2021,92 min,"Comedies, Romantic Movies"
s198,TV Show,I Heart Arlo,,2021,1 Season,"Kids' TV, TV Comedies"
s199,TV Show,King of Boys: The Return of the King,Nigeria,2021,1 Season,"Crime TV Shows, International TV Shows, TV Dramas"
s200,Movie,Koi Aap Sa,India,2006,135 min,"Comedies, Dramas, International Movies"
s201,Movie,Krishna Cottage,India,2004,124 min,"Action & Adventure, Horror Movies, International Movies"
s202,Movie,Kucch To Hai,India,2003,136 min,"Dramas, International Movies, Thrillers"
s203,Movie,Kyaa Kool Hai Hum,India,2005,165 min,"Comedies, International Movies, Music & Musicals"
s204,Movie,Kyaa Kool Hain Hum 3,India,2016,124 min,"Comedies, International Movies"
s205,Movie,Kyaa Super Kool Hain Hum,India,2012,136 min,"Comedies, International Movies"
s206,Movie,Kyo Kii... Main Jhuth Nahin Bolta,India,2001,150 min,"Comedies, International Movies, Sci-Fi & Fantasy"
s207,Movie,"LSD: Love, Sex Aur Dhokha",India,2010,112 min,"Dramas, Independent Movies, International Movies"
s208,Movie,Mission Istaanbul: Darr Ke Aagey Jeet Hai,India,2008,119 min,"Action & Adventure, International Movies, Music & Musicals"
s209,Movie,Once Upon a Time in Mumbaai,India,2010,133 min,"Dramas, International Movies, Music & Musicals"
s210,Movie,Once Upon a Time in Mumbai Dobaara!,India,2013,142 min,"Dramas, International Movies, Music & Musicals"
s211,Movie,Ragini MMS,India,2011,93 min,"Horror Movies, International Movies"
s212,Movie,Ragini MMS 2,India,2014,113 min,"Horror Movies, International Movies"
s213,TV Show,Rebellion,Ireland,2016,2 Seasons,"International TV Shows, TV Dramas"
s214,TV Show,RIDE ON TIME,,2021,3 Seasons,"Docuseries, International TV Shows"
s215,Movie,SAS: Rise of the Black Swan,,2021,124 min,"Action & Adventure, International Movies"
s216,Movie,Shootout at Lokhandwala,India,2007,116 min,"Action & Adventure, Dramas, International Movies"
s217,Movie,Shor In the City,India,2011,106 min,"Comedies, Dramas, Independent Movies"
s218,Movie,The Dirty Picture,India,2011,145 min,"Comedies, Dramas, International Movies"
s219,TV Show,Titletown High,,2021,1 Season,"Reality TV, Teen TV Shows"
s220,TV Show,EDENS ZERO,Japan,2021,1 Season,"Anime Series, International TV Shows"
s221,TV Show,Family Reunion,United States,2021,4 Seasons,"Kids' TV, TV Comedies"
s222,Movie,"Bob Ross: Happy Accidents, Betrayal & Greed",,2021,93 min,Documentaries
s223,TV Show,Clickbait,,2021,1 Season,"Crime TV Shows, TV Dramas, TV Mysteries"
s224,TV Show,John of God: The Crimes of a Spiritual Healer,,2021,1 Season,"Crime TV Shows, Docuseries, International TV Shows"
s225,TV Show,Motel Makeover,,2021,1 Season,"International TV Shows, Reality TV"
s226,TV Show,Open Your Eyes,,2021,1 Season,"International TV Shows, TV Dramas, TV Mysteries"
s227,TV Show,Post Mortem: No One Dies in Skarnes,,2021,1 Season,"International TV Shows, TV Comedies, TV Dramas"
s228,Movie,Really Love,United States,2020,95 min,"Dramas, Independent Movies, Romantic Movies"
s229,Movie,The November Man,"United States, United Kingdom",2014,108 min,Action & Adventure
s230,Movie,The Old Ways,United States,2020,90 min,Horror Movies
s231,Movie,The River Runner,,2021,86 min,"Documentaries, Sports Movies"
s232,Movie,The Water Man,United States,2021,92 min,"Children & Family Movies, Dramas"
s233,TV Show,Wheel of Fortune,United States,2019,3 Seasons,Reality TV
s234,Movie,Count Me In,United Kingdom,2021,82 min,"Documentaries, Music & Musicals"
s235,TV Show,Oggy Oggy,,2021,1 Season,"Kids' TV, TV Comedies"
s236,Movie,Untold: Caitlyn Jenner,,2021,70 min,"Documentaries, LGBTQ Movies, Sports Movies"
s237,Movie,Boomika,,2021,122 min,"Horror Movies, International Movies, Thrillers"
s238,Movie,Boomika (Hindi),,2021,122 min,"Horror Movies, International Movies, Thrillers"
s239,Movie,Boomika (Malayalam),,2021,122 min,"Horror Movies, International Movies, Thrillers"
s240,Movie,Boomika (Telugu),,2021,122 min,"Horror Movies, International Movies, Thrillers"
s241,Movie,The Witcher: Nightmare of the Wolf,,2021,84 min,"Action & Adventure, Anime Features"
s242,TV Show,Manifest,United States,2021,3 Seasons,"TV Dramas, TV Mysteries, TV Sci-Fi & Fantasy"
s243,TV Show,Comedy Premium League,,2021,1 Season,"International TV Shows, TV Comedies"
s244,TV Show,Everything Will Be Fine,,2021,1 Season,"International TV Shows, Spanish-Language TV Shows, TV Comedies"
s245,Movie,Gunshot,,2018,96 min,"Dramas, International Movies, Thrillers"
s246,TV Show,Korean Cold Noodle Rhapsody,,2021,1 Season,"Docuseries, International TV Shows"
s247,Movie,Man in Love,,2021,115 min,"Dramas, International Movies, Romantic Movies"
s248,Movie,Sweet Girl,United States,2021,110 min,"Action & Adventure, Dramas"
s249,TV Show,The Chair,,2021,1 Season,"TV Comedies, TV Dramas"
s250,Movie,The Loud House Movie,,2021,88 min,"Children & Family Movies, Comedies, Music & Musicals"
s251,Movie,A Faraway Land,,2020,102 min,"Dramas, International Movies, Romantic Movies"
s252,Movie,Like Crazy,United States,2011,91 min,"Dramas, Independent Movies, Romantic Movies"
s253,Movie,Black Island,,2021,105 min,"International Movies, Thrillers"
s254,Movie,Bombay,India,1995,135 min,"Dramas, International Movies, Romantic Movies"
s255,TV Show,Go! Go! Cory Carson,United States,2021,5 Seasons,Kids' TV
s256,Movie,Memories of a Murderer: The Nilsen Tapes,,2021,86 min,"Documentaries, International Movies"
s257,Movie,Nneka The Pretty Serpent,,2020,140 min,"Dramas, International Movies"
s258,Movie,O Kadhal Kanmani,,2015,133 min,"Dramas, International Movies, Romantic Movies"
s259,Movie,Out of my league,,2020,92 min,"Comedies, Dramas, International Movies"
s260,Movie,Pahuna,"India, Nepal",2018,82 min,"Comedies, Dramas, International Movies"
s261,TV Show,The Defeated,,2020,1 Season,"Crime TV Shows, International TV Shows, TV Dramas"
s262,Movie,The Secret Diary of an Exchange Student,,2021,97 min,"Comedies, International Movies, Romantic Movies"
s263,Movie,Untold: Deal With the Devil,,2021,78 min,"Documentaries, LGBTQ Movies, Sports Movies"
s264,TV Show,Mother Goose Club,United States,2016,2 Seasons,Kids' TV
s265,Movie,Walk of Shame,United States,2014,94 min,"Comedies, Independent Movies"
s266,TV Show,Rascal Does Not Dream of Bunny Girl Senpai,Japan,2018,1 Season,"Anime Series, International TV Shows, Romantic TV Shows"
s267,TV Show,The Creative Indians,India,2020,1 Season,"Docuseries, International TV Shows"
s268,Movie,The Piano,"New Zealand, Australia, France, United States",1993,121 min,"Classic Movies, Dramas, Independent Movies"
s269,Movie,Unroyal,,2020,97 min,"Dramas, International Movies"
s270,TV Show,Winx Club,Italy,2015,2 Seasons,Kids' TV
s271,Movie,Beckett,"Italy, Brazil, Greece",2021,110 min,Action & Adventure
s272,TV Show,Brand New Cherry Flavor,United States,2021,1 Season,"TV Dramas, TV Horror, TV Mysteries"
s273,TV Show,Fast & Furious Spy Racers,United States,2021,5 Seasons,Kids' TV
s274,TV Show,Gone for Good,France,2021,1 Season,"Crime TV Shows, International TV Shows, TV Dramas"
s275,TV Show,Grace and Frankie,United States,2021,7 Seasons,"TV Comedies, TV Dramas"
s276,TV Show,The Kingdom,Argentina,2021,1 Season,"Crime TV Shows, International TV Shows, Spanish-Language TV Shows"
s277,TV Show,Valeria,Spain,2021,2 Seasons,"International TV Shows, Romantic TV Shows, Spanish-Language TV Shows"
s278,TV Show,AlRawabi School for Girls,Jordan,2021,1 Season,"International TV Shows, TV Dramas, Teen TV Shows"
s279,Movie,Lokillo: Nothing's the Same,Colombia,2021,64 min,Stand-Up Comedy
s280,Movie,Monster Hunter: Legends of the Guild,"United States, Japan",2021,59 min,"Action & Adventure, Anime Features, Children & Family Movies"
s281,TV Show,Bake Squad,United States,2021,1 Season,Reality TV
s282,Movie,Brother Jekwu,Nigeria,2016,101 min,"Comedies, International Movies"
s283,Movie,La diosa del asfalto,Mexico,2020,127 min,"Dramas, Independent Movies, International Movies"
s284,Movie,Misha and the Wolves,"Belgium, United Kingdom",2021,90 min,"Documentaries, International Movies"
s285,Movie,The Kissing Booth 3,"United Kingdom, United States",2021,114 min,"Comedies, Romantic Movies"
