show id,type,title,country,release year,duration,listed inside
s4444,Movie,Husbands in Goa,India,2012,150 min,"Comedies, International Movies, Music & Musicals"
s4445,Movie,Jatts in Golmaal,India,2013,128 min,"Comedies, International Movies, Music & Musicals"
s4446,Movie,Kai Po Che!,India,2013,120 min,"Dramas, International Movies, Sports Movies"
s4447,Movie,Kalakalappu,India,2012,154 min,"Comedies, International Movies, Music & Musicals"
s4448,Movie,Katt Williams: The Pimp Chronicles: Pt. 1,United States,2006,45 min,Stand-Up Comedy
s4449,Movie,Katti Batti,India,2015,132 min,"Comedies, Dramas, International Movies"
s4450,Movie,Life in a ... Metro,India,2007,126 min,"Dramas, International Movies, Music & Musicals"
s4451,Movie,Marc Maron: Thinky Pain,United States,2013,95 min,Stand-Up Comedy
s4452,Movie,Mumbai Meri Jaan,India,2008,135 min,"Dramas, International Movies"
s4453,Movie,Mundeyan Ton Bachke Rahin,India,2014,139 min,"Comedies, International Movies, Music & Musicals"
s4454,Movie,No One Killed Jessica,India,2011,131 min,"Dramas, International Movies"
s4455,Movie,Oye Lucky! Lucky Oye!,India,2008,118 min,"Comedies, Dramas, International Movies"
s4456,Movie,Paan Singh Tomar,India,2010,129 min,"Action & Adventure, Dramas, International Movies"
s4457,Movie,Raja Natwarlal,India,2014,131 min,"Dramas, International Movies, Thrillers"
s4458,Movie,Satyagraha,India,2013,146 min,"Dramas, International Movies, Music & Musicals"
s4459,Movie,Settai,India,2013,123 min,"Comedies, International Movies, Music & Musicals"
s4460,Movie,Sigaram Thodu,India,2014,141 min,"Dramas, International Movies, Thrillers"
s4461,Movie,Sommore: The Reign Continues,United States,2015,93 min,Stand-Up Comedy
s4462,TV Show,The Great British Baking Show: The Beginnings,,2012,1 Season,"British TV Shows, Reality TV"
s4463,Movie,The Untold Tales of Armistead Maupin,United States,2017,91 min,"Documentaries, LGBTQ Movies"
s4464,Movie,Vaya,South Africa,2016,106 min,"Dramas, Independent Movies, International Movies"
s4465,Movie,Welcome to Sajjanpur,India,2008,131 min,"Comedies, Dramas, International Movies"
s4466,Movie,Yeh Hai Bakrapur,India,2014,95 min,"Comedies, Dramas, Independent Movies"
s4467,Movie,Zokkomon,India,2011,104 min,"Children & Family Movies, Dramas"
s4468,Movie,Gun City,"Spain, France",2018,126 min,"Dramas, International Movies, Thrillers"
s4469,Movie,Heneral Luna,Philippines,2015,118 min,"Dramas, International Movies"
s4470,TV Show,Fate/EXTRA Last Encore,Japan,2018,2 Seasons,"Anime Series, International TV Shows"
s4471,Movie,Dragon Tiger Gate,"Hong Kong, China",2006,94 min,"Action & Adventure, International Movies"
s4472,Movie,Been So Long,,2018,100 min,"Dramas, International Movies, Music & Musicals"
s4473,Movie,Dovlatov,"Russia, Poland, Serbia",2018,126 min,"Dramas, International Movies"
s4474,Movie,Jefe,"Spain, Portugal",2018,90 min,"Comedies, Dramas, International Movies"
s4475,Movie,Santo Cachón,Colombia,2018,87 min,"Comedies, International Movies, Romantic Movies"
s4476,Movie,Shirkers,"United States, United Kingdom",2018,97 min,Documentaries
s4477,TV Show,Terrorism Close Calls,"United States, Czech Republic",2018,1 Season,"Crime TV Shows, Docuseries, International TV Shows"
s4478,Movie,W/O Ram,India,2018,115 min,"Dramas, International Movies, Thrillers"
s4479,TV Show,DreamWorks Spooky Stories,United States,2009,1 Season,"Kids' TV, TV Comedies"
s4480,TV Show,Great News,United States,2017,2 Seasons,TV Comedies
s4481,Movie,Ronnie Coleman: The King,United States,2018,93 min,Documentaries
s4482,Movie,Baahubali: The Beginning (English Version),,2015,138 min,"Action & Adventure, Dramas, International Movies"
s4483,Movie,ADAM SANDLER 100% FRESH,United States,2018,74 min,Stand-Up Comedy
s4484,TV Show,Here to Heart,China,2018,1 Season,"International TV Shows, Romantic TV Shows, TV Dramas"
s4485,Movie,Scorpion King 5: Book of Souls,United States,2018,102 min,"Action & Adventure, Sci-Fi & Fantasy"
s4486,TV Show,The Hollywood Masters,United States,2017,3 Seasons,Stand-Up Comedy & Talk Shows
s4487,Movie,How to Get Over a Breakup,Peru,2018,104 min,"Comedies, International Movies, Romantic Movies"
s4488,TV Show,Accidentally in Love,China,2018,1 Season,"International TV Shows, Romantic TV Shows, TV Comedies"
s4489,TV Show,Ask the Doctor,Australia,2017,1 Season,"Docuseries, International TV Shows, Science & Nature TV"
s4490,TV Show,Best.Worst.Weekend.Ever.,United States,2018,1 Season,"Kids' TV, TV Comedies"
s4491,Movie,"Club de Cuervos Presents: I, Potro","Mexico, Argentina",2018,51 min,Movies
s4492,Movie,Derren Brown: Sacrifice,,2018,50 min,Movies
s4493,Movie,Gnome Alone,"United Kingdom, Canada, United States, Cayman Islands",2018,86 min,"Children & Family Movies, Comedies"
s4494,Movie,Illang: The Wolf Brigade,South Korea,2018,140 min,"Action & Adventure, International Movies, Sci-Fi & Fantasy"
s4495,TV Show,Making a Murderer,United States,2018,2 Seasons,"Crime TV Shows, Docuseries"
s4496,TV Show,Marvel's Daredevil,United States,2018,3 Seasons,"Crime TV Shows, TV Action & Adventure"
s4497,Movie,Naa Bangaaru Talli,India,2013,122 min,"Dramas, International Movies"
s4498,Movie,Oddbods: Party Monsters,,2018,23 min,Movies
s4499,TV Show,Project S The Series,Thailand,2017,4 Seasons,"International TV Shows, TV Dramas, Teen TV Shows"
s4500,Movie,S Storm,"Hong Kong, China",2016,95 min,"Action & Adventure, International Movies"
s4501,Movie,The Night Comes for Us,"Indonesia, United States",2018,121 min,"Action & Adventure, International Movies"
s4502,TV Show,Wanderlust,United Kingdom,2018,1 Season,"British TV Shows, International TV Shows, Romantic TV Shows"
s4503,Movie,Mr. Chandramouli,India,2018,131 min,"Dramas, International Movies, Thrillers"
s4504,TV Show,My Babysitter's a Vampire,Canada,2012,2 Seasons,"Kids' TV, TV Comedies"
s4505,TV Show,Rake,Australia,2018,5 Seasons,"Crime TV Shows, International TV Shows, TV Comedies"
s4506,Movie,"Ron White: If You Quit Listening, I'll Shut Up",United States,2018,63 min,Stand-Up Comedy
s4507,Movie,Meghnadbodh Rohoshyo,India,2017,150 min,"Dramas, International Movies"
s4508,Movie,Sanju,India,2018,159 min,"Dramas, International Movies"
s4509,TV Show,Stunt Science,United Kingdom,2018,1 Season,"British TV Shows, International TV Shows, Reality TV"
s4510,Movie,Soorma,India,2018,131 min,"Dramas, International Movies, Sports Movies"
s4511,Movie,Apostle,"United Kingdom, United States",2018,130 min,"Horror Movies, International Movies, Thrillers"
s4512,TV Show,Edgar Rice Burroughs' Tarzan and Jane,,2018,2 Seasons,"Crime TV Shows, Kids' TV"
s4513,Movie,Errementari: The Blacksmith and the Devil,"Spain, France",2018,99 min,"Horror Movies, International Movies, Sci-Fi & Fantasy"
s4514,Movie,Feminists: What Were They Thinking?,United States,2018,86 min,"Documentaries, LGBTQ Movies"
s4515,TV Show,FIGHTWORLD,,2018,1 Season,Docuseries
s4516,Movie,Kuntilanak,Indonesia,2018,106 min,"Horror Movies, International Movies"
s4517,Movie,ReMastered: Who Shot the Sheriff,United States,2018,57 min,"Documentaries, Music & Musicals"
s4518,TV Show,The Curious Creations of Christine McConnell,United States,2018,1 Season,"TV Comedies, TV Mysteries"
s4519,TV Show,The Haunting of Hill House,United States,2018,1 Season,"TV Dramas, TV Horror, TV Mysteries"
s4520,Movie,The Kindergarten Teacher,"United States, Israel, United Kingdom, Canada",2018,97 min,"Dramas, Independent Movies"
s4521,TV Show,Ordinary Heroes,,2018,1 Season,"Crime TV Shows, International TV Shows, TV Dramas"
s4522,TV Show,Salt Fat Acid Heat,,2018,1 Season,Docuseries
s4523,Movie,22-Jul,"Norway, Iceland, United States",2018,144 min,"Dramas, Thrillers"
s4524,TV Show,Blood Pact,Brazil,2018,1 Season,"Crime TV Shows, International TV Shows, TV Dramas"
s4525,Movie,Tales From the Hood 2,United States,2018,110 min,"Cult Movies, Horror Movies, Independent Movies"
s4526,Movie,Mo Amer: The Vagabond,United States,2018,57 min,Stand-Up Comedy
s4527,Movie,Pulang,Malaysia,2018,119 min,"Action & Adventure, Dramas, International Movies"
s4528,TV Show,Sofia the First,United States,2017,4 Seasons,Kids' TV
s4529,Movie,Seven in Heaven,United States,2018,94 min,Horror Movies
s4530,TV Show,Dancing Queen,,2018,1 Season,Reality TV
s4531,TV Show,Empire Games,"Czech Republic, United States",2018,1 Season,Docuseries
s4532,TV Show,LOST SONG,Japan,2018,1 Season,"Anime Series, International TV Shows"
s4533,Movie,Malevolent,United Kingdom,2018,89 min,"Horror Movies, Thrillers"
s4534,Movie,Private Life,United States,2018,124 min,"Comedies, Dramas, Independent Movies"
s4535,Movie,Super Monsters Save Halloween,,2018,25 min,Children & Family Movies
s4536,TV Show,YG Future Strategy Office,South Korea,2018,1 Season,"International TV Shows, Korean TV Shows, TV Comedies"
s4537,TV Show,Violet Evergarden: Special,,2018,1 Season,"Anime Series, International TV Shows, Romantic TV Shows"
s4538,Movie,The Black Prince,"United Kingdom, India, United States",2017,121 min,"Dramas, International Movies"
s4539,Movie,Truth or Dare,United States,2017,88 min,Horror Movies
s4540,Movie,Death Race: Beyond Anarchy,"United States, Bulgaria",2017,111 min,Action & Adventure
s4541,Movie,Eric ldle's What About Dick?,United States,2012,81 min,"Comedies, Music & Musicals"
s4542,Movie,Joe Rogan: Strange Times,,2018,64 min,Stand-Up Comedy
s4543,TV Show,Monty Python Best Bits (mostly),United Kingdom,2014,1 Season,"British TV Shows, Docuseries, TV Comedies"
s4544,Movie,Monty Python Conquers America,,2008,55 min,Documentaries
s4545,Movie,"Monty Python Live (Mostly): One Down, Five to Go",United Kingdom,2014,137 min,Comedies
s4546,Movie,Monty Python: Before the Flying Circus,United Kingdom,2000,56 min,"Comedies, Documentaries"
s4547,Movie,Monty Python: Live at Aspen,United States,1998,58 min,"Comedies, Documentaries"
s4548,Movie,Monty Python: Live at The Hollywood Bowl,United Kingdom,1982,80 min,Comedies
s4549,Movie,Monty Python: The Meaning of Live,United Kingdom,2014,94 min,Documentaries
s4550,TV Show,Monty Python's Almost the Truth,United Kingdom,2009,1 Season,"British TV Shows, Docuseries"
s4551,TV Show,Monty Python's Fliegender Zirkus,"United Kingdom, West Germany",1972,1 Season,"International TV Shows, TV Comedies"
s4552,TV Show,Monty Python's Flying Circus,United Kingdom,1974,4 Seasons,"British TV Shows, Classic & Cult TV, International TV Shows"
s4553,Movie,Monty Python's Life of Brian,United Kingdom,1979,94 min,"Classic Movies, Comedies, Cult Movies"
s4554,TV Show,Monty Python's Personal Best,"United States, United Kingdom",2005,1 Season,"British TV Shows, TV Comedies"
s4555,Movie,Parrot Sketch Not Included: Twenty Years of Monty Python,United Kingdom,1989,72 min,Comedies
s4556,Movie,The Meaning of Monty Python,United Kingdom,2013,60 min,Documentaries
s4557,Movie,25 Kille,India,2016,140 min,"Action & Adventure, Dramas, International Movies"
s4558,Movie,A Witches' Ball,Canada,2017,91 min,Children & Family Movies
s4559,Movie,Agyaat,India,2009,97 min,"Horror Movies, International Movies"
s4560,Movie,Anjaan,India,2014,146 min,"Action & Adventure, Dramas, International Movies"
s4561,Movie,Bathinda Express,India,2016,118 min,"Dramas, International Movies, Sports Movies"
s4562,Movie,Delhi 6,India,2009,128 min,"Dramas, International Movies"
s4563,Movie,Dev.D,India,2009,137 min,"Dramas, International Movies, Romantic Movies"
s4564,Movie,Dil Vil Pyaar Vyaar,India,2014,145 min,"International Movies, Music & Musicals, Romantic Movies"
s4565,Movie,Dushman,,2017,141 min,"Dramas, International Movies"
s4566,Movie,Ek Main Aur Ekk Tu,India,2012,106 min,"Comedies, International Movies, Romantic Movies"
s4567,Movie,Freedom at Midnight,,2018,135 min,"Dramas, Independent Movies, International Movies"
s4568,Movie,Haani,India,2013,137 min,"Dramas, International Movies, Music & Musicals"
s4569,Movie,Happy Go Lucky,India,2014,129 min,"Comedies, International Movies, Music & Musicals"
s4570,Movie,Harishchandrachi Factory,India,2009,99 min,"Dramas, International Movies"
s4571,TV Show,Hot Date,United States,2018,1 Season,"Romantic TV Shows, TV Comedies"
s4572,Movie,Jagga Jasoos,India,2017,155 min,"Action & Adventure, Comedies, International Movies"
s4573,Movie,Jatt James Bond,India,2014,142 min,"Comedies, Dramas, International Movies"
s4574,Movie,Jodhaa Akbar,India,2008,214 min,"Action & Adventure, Dramas, International Movies"
s4575,Movie,Judge Singh LLB,India,2015,137 min,"Comedies, Dramas, International Movies"
s4576,Movie,Kaminey,India,2009,128 min,"Dramas, International Movies, Music & Musicals"
s4577,Movie,Khido Khundi,India,2018,151 min,"Dramas, International Movies, Sports Movies"
s4578,Movie,Khoobsurat,India,2014,121 min,"Comedies, International Movies, Romantic Movies"
s4579,Movie,Kisaan,India,2009,101 min,"Action & Adventure, Dramas, International Movies"
s4580,Movie,Kismat Konnection,India,2008,145 min,"Comedies, Dramas, International Movies"
s4581,Movie,Kurbaan,India,2009,147 min,"International Movies, Thrillers"
s4582,Movie,Lock,India,2016,90 min,"Dramas, International Movies"
s4583,Movie,Luv Shuv Tey Chicken Khurana,India,2012,129 min,"Comedies, International Movies, Romantic Movies"
s4584,Movie,"Main, Meri Patni Aur Woh",India,2005,129 min,"Comedies, Dramas, International Movies"
s4585,Movie,Manje Bistre,India,2017,136 min,"Comedies, Dramas, International Movies"
s4586,Movie,Motor Mitraan Di,India,2016,117 min,"Comedies, International Movies"
s4587,Movie,Mugamoodi,India,2012,150 min,"Action & Adventure, International Movies"
s4588,Movie,Muran,India,2011,134 min,"Action & Adventure, International Movies"
s4589,Movie,My Friend Pinto,India,2011,100 min,"Comedies, International Movies, Sci-Fi & Fantasy"
s4590,Movie,My Little Pony Equestria Girls: Forgotten Friendship,United States,2018,44 min,Children & Family Movies
s4591,Movie,My Little Pony Equestria Girls: Rollercoaster of Friendship,"United States, Canada",2018,44 min,Children & Family Movies
s4592,Movie,My Suicide,United States,2009,111 min,"Comedies, Dramas, Independent Movies"
s4593,Movie,Naan Sigappu Manithan,India,2014,147 min,"Action & Adventure, Dramas, International Movies"
s4594,Movie,Nasha,India,2013,115 min,"Dramas, International Movies, Romantic Movies"
s4595,Movie,Naughty Jatts,India,2013,121 min,"Comedies, International Movies, Music & Musicals"
s4596,Movie,Needhi Singh,India,2016,103 min,"Action & Adventure, Dramas, International Movies"
s4597,Movie,Peace Haven,"India, United States",2016,73 min,"Comedies, Dramas, Independent Movies"
s4598,Movie,Phantom,India,2015,129 min,"Action & Adventure, International Movies"
s4599,Movie,Pizza,India,2014,102 min,"Horror Movies, International Movies, Thrillers"
s4600,Movie,Pooja Kiven Aa,India,2013,122 min,"Comedies, International Movies, Music & Musicals"
s4601,Movie,Race,India,2008,155 min,"Action & Adventure, International Movies, Music & Musicals"
s4602,Movie,Race 2,India,2013,139 min,"Action & Adventure, International Movies, Music & Musicals"
s4603,Movie,Saadey CM Saab,India,2015,131 min,"Comedies, Dramas, International Movies"
s4604,Movie,Sat Shri Akaal England,India,2017,127 min,"Comedies, Dramas, International Movies"
s4605,TV Show,Strong,United States,2016,1 Season,Reality TV
s4606,Movie,Thaandavam,India,2012,156 min,"Action & Adventure, International Movies, Music & Musicals"
s4607,Movie,The Birth Reborn,,2018,91 min,"Documentaries, International Movies"
s4608,Movie,Theeya Velai Seyyanum Kumaru,India,2013,132 min,"Comedies, International Movies, Music & Musicals"
s4609,TV Show,Three Wives One Husband,United Kingdom,2018,1 Season,"British TV Shows, International TV Shows, Reality TV"
s4610,Movie,Tiger,India,2016,130 min,"Action & Adventure, Dramas, International Movies"
s4611,Movie,Udaan,India,2010,137 min,"Dramas, Independent Movies, International Movies"
s4612,Movie,Vettai,India,2012,156 min,"Action & Adventure, International Movies, Music & Musicals"
s4613,Movie,Wake Up Sid,India,2009,132 min,"Comedies, International Movies, Romantic Movies"
s4614,Movie,We Are Family,"India, Australia",2010,119 min,"Dramas, International Movies"
s4615,Movie,What the Jatt!!,India,2015,140 min,"Comedies, International Movies, Romantic Movies"
s4616,Movie,Zindagi Kitni Haseen Hay,Pakistan,2016,126 min,"Dramas, International Movies, Romantic Movies"
s4617,Movie,Big Miracle,"United States, United Kingdom",2012,107 min,"Children & Family Movies, Dramas"
s4618,Movie,Paradise Lost,Brazil,2018,111 min,"Dramas, Independent Movies, International Movies"
s4619,Movie,Animal World,China,2018,130 min,"Action & Adventure, International Movies, Sci-Fi & Fantasy"
s4620,Movie,Hold the Dark,United States,2018,126 min,"Action & Adventure, Dramas"
s4621,Movie,Lessons from a School Shooting: Notes from Dunblane,United States,2018,24 min,Documentaries
s4622,TV Show,Made in Mexico,United States,2018,1 Season,"International TV Shows, Reality TV, Spanish-Language TV Shows"
s4623,TV Show,Reboot: The Guardian Code,Canada,2018,2 Seasons,Kids' TV
s4624,TV Show,Skylanders Academy,"South Korea, United States",2018,3 Seasons,"Kids' TV, TV Comedies"
s4625,Movie,The 3rd Eye,Indonesia,2018,108 min,"Horror Movies, International Movies"
s4626,Movie,Two Catalonias,Spain,2018,117 min,"Documentaries, International Movies"
s4627,Movie,In Darkness,"United Kingdom, United States",2018,101 min,"Independent Movies, International Movies, Thrillers"
s4628,TV Show,Battlefish,,2018,1 Season,"Reality TV, Science & Nature TV, TV Action & Adventure"
s4629,TV Show,DRAGON PILOT: Hisone & Masotan,Japan,2018,1 Season,"Anime Series, International TV Shows"
s4630,TV Show,Maniac,United States,2018,1 Season,"TV Comedies, TV Dramas, TV Mysteries"
s4631,Movie,Quincy,United States,2018,124 min,"Documentaries, Music & Musicals"
s4632,Movie,Rafinha Bastos: Ultimatum,Brazil,2018,63 min,Stand-Up Comedy
s4633,TV Show,The Good Cop,United States,2018,1 Season,"Crime TV Shows, TV Comedies, TV Dramas"
s4634,TV Show,Mobile Suit Gundam UC,Japan,2014,1 Season,"Anime Series, International TV Shows"
s4635,TV Show,Transformers: Rescue Bots,"Canada, United States",2016,1 Season,Kids' TV
s4636,TV Show,Al Hayba,Lebanon,2017,1 Season,"Crime TV Shows, International TV Shows, TV Dramas"
s4637,TV Show,American Vandal,United States,2018,2 Seasons,"Crime TV Shows, TV Comedies, Teen TV Shows"
s4638,TV Show,Boca Juniors Confidential,,2018,1 Season,"Docuseries, International TV Shows, Spanish-Language TV Shows"
s4639,TV Show,Ingobernable,Mexico,2018,2 Seasons,"Crime TV Shows, International TV Shows, Spanish-Language TV Shows"
s4640,TV Show,Norm Macdonald Has a Show,United States,2018,1 Season,"Stand-Up Comedy & Talk Shows, TV Comedies"
s4641,TV Show,Super Monsters Monster Party,,2018,1 Season,Kids' TV
s4642,Movie,The Angel,"Israel, United States",2018,114 min,"Dramas, International Movies, Thrillers"
s4643,Movie,The Land of Steady Habits,United States,2018,98 min,"Comedies, Dramas, Independent Movies"
s4644,TV Show,The Rise of Phoenixes,China,2018,1 Season,"International TV Shows, Romantic TV Shows, TV Action & Adventure"
s4645,Movie,Reversing Roe,United States,2018,100 min,Documentaries
s4646,TV Show,Life,South Korea,2018,1 Season,"International TV Shows, Korean TV Shows, TV Dramas"
s4647,Movie,On My Skin,Italy,2018,100 min,"Dramas, International Movies"
s4648,TV Show,Daniel Sloss: Live Shows,United States,2018,1 Season,"Stand-Up Comedy & Talk Shows, TV Comedies"
s4649,TV Show,If I were an Animal,,2018,1 Season,"Docuseries, Kids' TV, Science & Nature TV"
s4650,Movie,The Resistance Banker,Netherlands,2018,123 min,"Dramas, International Movies"
s4651,TV Show,Show Me the Money,,2004,2 Seasons,"International TV Shows, TV Comedies"
s4652,TV Show,Transformers Prime,United States,2013,1 Season,Kids' TV
s4653,TV Show,Transformers: Robots in Disguise,United States,2016,1 Season,Kids' TV
s4654,Movie,City of Joy,"United States,",2018,77 min,Documentaries
s4655,TV Show,First and Last,,2018,1 Season,Docuseries
s4656,TV Show,Marvel's Iron Fist,United States,2018,2 Seasons,"Crime TV Shows, TV Action & Adventure, TV Dramas"
s4657,Movie,Next Gen,"China, Canada, United States",2018,106 min,"Children & Family Movies, Comedies, Sci-Fi & Fantasy"
s4658,Movie,Sierra Burgess Is A Loser,United States,2018,106 min,"Comedies, Romantic Movies"
s4659,TV Show,Stretch Armstrong & the Flex Fighters,United States,2018,2 Seasons,Kids' TV
s4660,Movie,The Most Assassinated Woman in the World,"Belgium, United Kingdom, United States",2018,102 min,"Dramas, International Movies, Thrillers"
s4661,Movie,PK,India,2014,146 min,"Comedies, Dramas, International Movies"
s4662,Movie,The Debt Collector,"United Kingdom, United States",2018,96 min,Action & Adventure
s4663,TV Show,Monkey Twins,Thailand,2018,1 Season,"Crime TV Shows, International TV Shows, TV Action & Adventure"
s4664,TV Show,Quantico,United States,2018,3 Seasons,"Crime TV Shows, TV Dramas, TV Mysteries"
s4665,TV Show,Age of Rebellion,Taiwan,2018,1 Season,"Crime TV Shows, International TV Shows, TV Dramas"
s4666,Movie,Carbon,"France, Belgium",2017,104 min,"Dramas, International Movies, Thrillers"
s4667,Movie,Garbage,India,2018,109 min,"Dramas, Independent Movies, International Movies"
s4668,Movie,​​Kuch Bheege Alfaaz,India,2018,110 min,"Dramas, Independent Movies, International Movies"
s4669,Movie,Love and Shukla,India,2017,110 min,"Dramas, Independent Movies, International Movies"
s4670,Movie,Once Again,"India, Germany, Austria",2018,101 min,"Dramas, Independent Movies, International Movies"
s4671,TV Show,Sisters,Australia,2018,1 Season,"International TV Shows, TV Comedies, TV Dramas"
s4672,Movie,Sparring,France,2017,94 min,"Dramas, International Movies, Sports Movies"
s4673,TV Show,Cathedral of the Sea,Spain,2017,1 Season,"International TV Shows, Spanish-Language TV Shows, TV Dramas"
s4674,TV Show,Inside the Criminal Mind,"United States, Czech Republic",2018,1 Season,"Crime TV Shows, Docuseries, International TV Shows"
s4675,TV Show,The Comedy Lineup,United States,2018,2 Seasons,"Stand-Up Comedy & Talk Shows, TV Comedies"
s4676,Movie,The Laws of Thermodynamics,Spain,2018,101 min,"Comedies, International Movies, Romantic Movies"
s4677,TV Show,Ultimate Beastmaster,"United States, Brazil, South Korea, Mexico, Japan, Germany",2018,3 Seasons,Reality TV
s4678,TV Show,Ultimate Beastmaster México,,2018,3 Seasons,"Reality TV, Spanish-Language TV Shows"
s4679,TV Show,Undercover Law,Colombia,2017,1 Season,"Crime TV Shows, International TV Shows, Spanish-Language TV Shows"
s4680,Movie,Naam Shabana,India,2017,141 min,"Action & Adventure, International Movies"
s4681,Movie,Qarib Qarib Singlle,India,2017,120 min,"Comedies, International Movies, Romantic Movies"
s4682,Movie,Spyder,India,2017,140 min,"Action & Adventure, International Movies"
s4683,TV Show,Chicken Soup for the Soul's Being Dad,United States,2018,1 Season,Docuseries
s4684,Movie,Maria Bamford: The Special Special Special,United States,2012,50 min,Stand-Up Comedy
s4685,Movie,Bert Kreischer: Secret Time,,2018,57 min,Stand-Up Comedy
s4686,TV Show,GHOUL,India,2018,1 Season,"International TV Shows, TV Dramas, TV Horror"
s4687,Movie,One Last Shot,Canada,1998,31 min,Comedies
s4688,TV Show,Take My Brother Away,China,2018,1 Season,"International TV Shows, TV Comedies, TV Dramas"
s4689,Movie,The After Party,United States,2018,90 min,"Comedies, Music & Musicals"
s4690,TV Show,The Innocents,United Kingdom,2018,1 Season,"British TV Shows, International TV Shows, Romantic TV Shows"
s4691,Movie,Bareilly Ki Barfi,India,2017,110 min,"Comedies, Dramas, International Movies"
s4692,Movie,Mersal,India,2017,162 min,"Action & Adventure, Dramas, International Movies"
s4693,Movie,Mom,India,2017,139 min,"Dramas, International Movies, Thrillers"
s4694,Movie,Pad Man,India,2018,130 min,"Dramas, International Movies, Romantic Movies"
s4695,Movie,Toilet: Ek Prem Katha,India,2017,145 min,"Comedies, Dramas, International Movies"
s4696,Movie,Party Monster: Scratching the Surface,United States,2018,33 min,Comedies
s4697,TV Show,Stay Here,United States,2018,1 Season,Reality TV
s4698,Movie,The Motive,"Spain, Mexico",2017,114 min,"Comedies, Dramas, International Movies"
s4699,Movie,To All the Boys I’ve Loved Before,United States,2018,100 min,"Comedies, International Movies, Romantic Movies"
s4700,Movie,Yoo Byung Jae: Discomfort Zone,South Korea,2018,54 min,Stand-Up Comedy
s4701,Movie,Bhavesh Joshi Superhero,India,2018,150 min,"Dramas, International Movies, Sci-Fi & Fantasy"
s4702,Movie,For Here or to Go?,"United States, India",2015,105 min,"Comedies, Dramas, Independent Movies"
s4703,TV Show,72 Dangerous Animals: Asia,Australia,2018,1 Season,"Docuseries, International TV Shows, Science & Nature TV"
s4704,TV Show,Afflicted,United States,2018,1 Season,"Docuseries, Reality TV, Science & Nature TV"
s4705,TV Show,All About the Washingtons,United States,2018,1 Season,TV Comedies
s4706,Movie,The Guernsey Literary and Potato Peel Pie Society,"United Kingdom, France, United States",2018,124 min,"Dramas, Romantic Movies"
s4707,Movie,The Package,United States,2018,95 min,Comedies
s4708,Movie,Zion,United States,2018,12 min,"Documentaries, Sports Movies"
s4709,Movie,Perdida,"Argentina, Spain",2018,104 min,"Dramas, International Movies, Thrillers"
s4710,TV Show,The Originals,United States,2018,5 Seasons,"TV Dramas, TV Horror, TV Mysteries"
s4711,TV Show,Pretty Man,,2018,1 Season,"International TV Shows, Romantic TV Shows, TV Dramas"
s4712,TV Show,On Children,Taiwan,2018,1 Season,"International TV Shows, TV Dramas, TV Mysteries"
s4713,Movie,2 States,India,2014,143 min,"Comedies, Dramas, International Movies"
s4714,Movie,Baaghi,India,2016,127 min,"Action & Adventure, International Movies"
s4715,Movie,Brij Mohan Amar Rahe,India,2018,100 min,"Comedies, Dramas, International Movies"
s4716,Movie,Flavors of Youth: International Version,"China, Japan",2018,74 min,"Anime Features, International Movies, Romantic Movies"
s4717,TV Show,Cocaine Coast,Spain,2018,1 Season,"Crime TV Shows, International TV Shows, Spanish-Language TV Shows"
s4718,TV Show,Dinotrux Supercharged,,2018,3 Seasons,Kids' TV
